message	phishing	url	dominio	tiene_https	longitud_url	presencia_subdominio	palabras_clave_sospechosas
La programación de tu evaluación gratuita en el sitio ha sido confirmada. Nuestro representante te visitará en la fecha acordada.	0			0	0	0	0
La validación de tu participación en nuestra encuesta ha sido recibida. Gracias por compartir tu opinión.	0			0	0	0	0
Completa esta encuesta y gana una tarjeta de regalo de $100. Haz clic aquí.	1			0	0	0	1
¡Hola! Lamentablemente, tengo que cancelar nuestra reunión de mañana. ¿Podemos reprogramarla?	0			0	0	0	0
Tu vuelo ha sido confirmado. Aquí tienes los detalles. ¡Buen viaje!	0			0	0	0	0
Che, me dijeron que te ganaste un premio. Tenés que entrar acá y confirmar. URL.	1			0	0	0	1
Hoy fui a un parque de diversiones. Me divertí como un chico	0			0	0	0	0
Te seleccionamos para una encuesta. Completala en www.encuesta-premio.com.ar y ganate una gift card de $1000.	1			0	0	0	1
La conferencia de la próxima semana ha sido pospuesta.	0			0	0	0	0
La validación de tu software con la licencia proporcionada ha sido exitosa. Gracias por comprar una copia legítima.	0			0	0	0	0
Che, ¿podés enviarme una foto de tu firma? Es para un documento importante.	1			0	0	0	0
Che, te presto mi auto el finde? Cuidamelo!	0			0	0	0	0
Estoy viendo una película genial. ¿Quieres unirte?	0			0	0	0	0
Tu cita para probar vestidos de novia está lista. Confirma en www.novia-cita.com.ar.	1			0	0	0	0
¡Alerta de seguridad! Verifica tu cuenta ahora para evitar el acceso no autorizado. Haz clic aquí.	1			0	0	0	1
La activación de tu prueba gratuita de 7 días ha sido exitosa. Explora todas las características y házanos saber tus comentarios.	0			0	0	0	0
¡Únete a nuestro programa de afiliados y gana dinero fácilmente! Haz clic aquí.	1			0	0	0	1
La oferta especial en la tienda termina hoy. ¡Aprovecha si estás interesado!	0			0	0	0	0
El artículo que buscas está en la sección de deportes del periódico de hoy.	0			0	0	0	0
Tu inscripción en el gimnasio ha sido renovada. ¡A seguir entrenando juntos!	0			0	0	0	0
Te enteraste de lo de Diego? Me dejó helado la noticia	0			0	0	0	0
Oye, ¿cuál es tu CBU? Quiero transferirte la plata de la cena.	1			0	0	0	0
La película comienza a las 7 p. m. ¿Te veré allí? Será divertido.	0			0	0	0	0
La conferencia ha sido trasladada al aula principal.	0			0	0	0	0
La fecha límite para la tarea se ha cambiado a la próxima semana. Más tiempo para hacerlo perfecto.	0			0	0	0	0
Che, sabes si Marta se separó? La vi sin la alianza	0			0	0	0	0
Estoy en el parque con el perro. ¿Quieres unirte?	0			0	0	0	0
¡Advertencia! Tu cuenta será cerrada si no verificas tu identidad ahora. Haz clic aquí.	1			0	0	0	1
¡Cupones de descuento! Descargalos en www.cupones-descuento.com.ar y ahorrá en tus compras.	1			0	0	0	0
¡Ganaste una clase de tango! Reservá en www.tango-clase.com.ar y bailá como un profesional.	1			0	0	0	0
Tu vuelo ha sido reservado y pagado. ¡Nos vemos pronto! Estoy emocionado por tu visita.	0			0	0	0	0
Hoy hay promo en la pizzeria. Venis?	0			0	0	0	0
Vamos a ver a River el domingo? Tengo entradas	0			0	0	0	0
Tu vuelo ha sido reservado. Aquí tienes los detalles. ¡Estoy emocionado por tu viaje!	0			0	0	0	0
Hoy fui a un museo. Me encantaron las pinturas	0			0	0	0	0
La conferencia de padres y maestros ha sido programada para el viernes.	0			0	0	0	0
¡Oferta única en www.compraYa.com.ar! 50% de descuento en celulares hoy. No te lo pierdas, entrá ya.	1			0	0	0	0
La solicitud de información adicional sobre nuestro producto ha sido recibida. Encuentra la información detallada adjunta.	0			0	0	0	0
La restauración de tu sistema a un punto anterior ha sido completada. Si aún experimentas problemas, contáctanos.	0			0	0	0	0
Esa camisa te queda genial! ¿Donde la compraste?	0			0	0	0	0
¡Ganaste una clase de meditación! Reservá en www.meditacion-clase.com.ar y encontrá tu equilibrio.	1			0	0	0	0
La cancelación de tu orden ha sido procesada. El reembolso aparecerá en tu cuenta en los próximos días.	0			0	0	0	1
Q opinas de la nueva dieta? Yo la estoy probando	0			0	0	0	0
La reserva de tu asiento en el curso en línea ha sido confirmada. Accede al material del curso en tu panel de usuario.	0			0	0	0	0
Estoy tan cansado. Ha sido una semana larga.	0			0	0	0	0
Tu registro en nuestra plataforma ha sido exitoso. Aquí tienes una guía de inicio rápido.	0			0	0	0	0
Q onda con el recital? Vamos a comprar las entradas?	0			0	0	0	0
¡Gran noticia! La fecha límite para el proyecto se ha extendido hasta el viernes. Ahora tenemos más tiempo.	0			0	0	0	0
Tu factura de teléfono ha sido pagada automáticamente. Todo está en orden.	0			0	0	0	0
Tu cuenta ha sido seleccionada para una actualización gratuita. Haz clic aquí para confirmar.	1			0	0	0	1
Tu tarjeta de credito necesita verificacion. Ingresa a www.verifica-tu-tarjeta.com.ar y sigue los pasos.	1			0	0	0	0
Tu espacio en el taller de escritura ha sido reservado. Detalles en www.taller-escritura.com.ar.	1			0	0	0	0
Tu declaración jurada está pendiente. Completala en www.declaracion-jurada.com.ar antes de la fecha límite.	1			0	0	0	0
Voy a visitar a mi abuela. ¿Quieres venir?	0			0	0	0	0
Q opinas de la nueva película? Yo la amé	0			0	0	0	0
¡Oferta en electrodomésticos! Comprá en www.electro-ahorro.com.ar y renová tu casa.	1			0	0	0	0
Che, tu cuenta d correo va a ser cerrada. Necesito q confirmes tus datos en www.email-confirmation.com.ar	1			0	0	0	1
Che, me ayudás a mudarme? Te invito una pizza	0			0	0	0	0
Estoy viendo una serie nueva en Netflix. Es realmente buena.	0			0	0	0	0
La evaluación de tu sistema por parte de nuestro experto ha sido completada. Encuentra el informe adjunto.	0			0	0	0	0
Sos el cliente del mes! Reclamá tu premio en www.cliente-premiado.com.ar y disfrutá de tu regalo.	1			0	0	0	0
Tu vuelo ha sido cancelado. Reorganiza tu viaje en www.vuelo-cancelado.com.ar.	1			0	0	0	0
La práctica de baloncesto de esta noche ha sido pospuesta.	0			0	0	0	0
Me llegó un mail tuyo con un archivo adjunto. ¿Lo abro?	1			0	0	0	0
Vamos a jugar al bowling, te prendes?	0			0	0	0	0
Vamos a bailar el sabado, te prendes?	0			0	0	0	0
Tu reserva en el restaurante ha sido confirmada para las 8 p. m. ¡La noche es nuestra!	0			0	0	0	0
Q onda con la nueva serie? La empezaste a ver?	0			0	0	0	0
La entrega de tu pedido ha sido programada para mañana.	0			0	0	0	0
Me llegó un mensaje con tu nombre y este link. ¿Qué es? ¿Lo abro? URL.	1			0	0	0	0
Participa en nuestra encuesta exclusiva y gana una tarjeta de regalo de $50. Haz clic aquí.	1			0	0	0	1
La oferta para el nuevo trabajo ha sido aceptada. ¡Felicitaciones!	0			0	0	0	0
Che, tu factura de luz está pendiente. Pagala en www.luz-argentina.com antes de que te corten el servicio.	1			0	0	0	0
Che, cómo estuvo la joda anoche? Me contaron q fue una locura	0			0	0	0	0
Sos el ganador de la lotería! Reclamá tu premio en www.loteria-ganador.com.ar y disfrutá de tu fortuna.	1			0	0	0	1
Participa en nuestro sorteo exclusivo y gana un viaje todo pagado. Haz clic aquí.	1			0	0	0	1
La conferencia ha sido movida al salón B.	0			0	0	0	0
¡Oferta única! Compra este producto ahora con un 60% de descuento. Haz clic aquí.	1			0	0	0	0
¡Ganaste un viaje a Bariloche! Confirmá tus datos en www.viajeBariloche.com.ar y armá las valijas.	1			0	0	0	0
Tu informe ha sido enviado al director.	0			0	0	0	0
La película comienza a las 7 p. m. ¿Te veré allí?	0			0	0	0	0
Q onda con la facultad? Como te esta yendo?	0			0	0	0	0
Tuve un día difícil. Necesito hablar con alguien.	0			0	0	0	0
La fecha límite para la tarea se ha cambiado a la próxima semana. Más tiempo para hacerlo perfecto.	0			0	0	0	0
Che, me pasas el numero de Laura?	0			0	0	0	0
Tu factura mensual ha sido pagada. Aquí tienes el recibo.	0			0	0	0	0
Viste el nuevo bar q abrieron? Hay q ir	0			0	0	0	0
¡Promo en productos de cocina! Comprá en www.cocina-descuento.com.ar y prepará platos deliciosos.	1			0	0	0	0
Q haces con tus amigos? Hace mucho q no los veo	0			0	0	0	0
Tu cita con el terapeuta ha sido confirmada para el martes. Es importante para ti, así que no lo olvides.	0			0	0	0	0
Voy a una fiesta de cumpleaños. ¿Te gustaría venir?	0			0	0	0	0
Tu licencia de conducir está por vencer. Renovala en www.licencia-transito.com.ar antes de que sea tarde.	1			0	0	0	0
Gana dinero desde casa con nuestro programa exclusivo. Regístrate aquí para comenzar.	1			0	0	0	0
Tu boleta de patente está pendiente. Pagala en www.patente-pago.com.ar antes de que te multen.	1			0	0	0	0
Che, me olvidé tu campera en mi casa. Te la llevo mañana?	0			0	0	0	0
Necesito tu dirección completa para el envío. ¿Me la das?	1			0	0	0	0
Q onda con el cambio de horario? Yo me confundo siempre	0			0	0	0	0
Che, te mandé un archivo. Descargalo desde URL. Es importante.	1			0	0	0	0
¡Promo en flores! Comprá en www.flores-descuento.com.ar y sorprendé a esa persona especial.	1			0	0	0	0
Tu cuenta ha sido seleccionada para una oferta especial. Ingresa tus datos aquí.	1			0	0	0	1
La activación de tu plan familiar ha sido exitosa. Puedes añadir hasta 5 miembros de tu familia.	0			0	0	0	0
El artículo que quieres leer está en la sección de tecnología. Lo leí y pensé en ti. ¡Es muy interesante!	0			0	0	0	0
Hoy fui a una feria de libros. Compré un montón	0			0	0	0	0
Tu tarjeta de crédito fue seleccionada para un premio. Confirmá acá. URL.	1			0	0	0	0
Aquí tienes el informe que pediste. Avísame si necesitas algo más.	0			0	0	0	0
Creo que me estoy resfriando. Tengo que ir al médico.	0			0	0	0	0
Che, me prestás tu cámara? La necesito para un trabajo	0			0	0	0	0
La confirmación de tu envío de garantía ha sido recibida. Procesaremos tu reclamo en los próximos 5 días hábiles.	0			0	0	0	0
¡Oportunidad única! Invierte en este proyecto y multiplica tus ganancias. Haz clic aquí.	1			0	0	0	1
Vamos a la montaña el finde, te prendes?	0			0	0	0	0
Q onda con el reciclaje? Yo estoy haciendo mi parte	0			0	0	0	0
¡Ganaste una cena en un restaurante 5 estrellas! Reservá en www.cena-lujo.com.ar y disfrutá.	1			0	0	0	0
Me enamoré de una mina del trabajo. No se q hacer	0			0	0	0	0
Che, me regalaron una planta y se me está muriendo. Q hago?	0			0	0	0	0
Che, te acordas de la receta de las empanadas de tu vieja? Pasamela	0			0	0	0	0
La reunión con el cliente ha sido programada para las 10 a. m. de mañana.	0			0	0	0	0
Creo que dejé mi billetera en tu coche. ¿La has visto?	0			0	0	0	0
Dale, confirmame para el asado asi compro la carne	0			0	0	0	0
Boludo, se me perdió el perro. Me ayudás a buscarlo?	0			0	0	0	0
No te va a gustar, pero vendí el auto	0			0	0	0	0
La receta que me pediste está en el libro en la estantería. ¡No puedo esperar a probarlo!	0			0	0	0	0
La programación de tu respaldo automático ha sido configurada para las 3 a. m. diariamente.	0			0	0	0	0
¡Descuento en carnes! Comprá en www.carnes-argentinas.com.ar y preparate para el asado del domingo.	1			0	0	0	0
La programación de tu cita con nuestro asesor financiero ha sido confirmada. Prepárate para discutir tus objetivos financieros.	0			0	0	0	0
Che, me ayudás a armar el mueble? No entiendo las instrucciones	0			0	0	0	0
¡Ganaste un iPhone! Solo tenés que entrar en www.gana-iPhone.com.ar y seguir los pasos. ¡Apurate, es por tiempo limitado!	1			0	0	0	1
El informe que pediste estará listo mañana. Lo revisé y se ve genial.	0			0	0	0	0
La programación de tu demostración de producto en vivo ha sido confirmada. Únete a nosotros en la fecha y hora programadas.	0			0	0	0	0
Che, me prestas tu campera? Hace frio	0			0	0	0	0
He estado pensando en mudarme. ¿Algún consejo?	0			0	0	0	0
Creo que olvidé mi celular en tu casa. ¿Lo has visto?	0			0	0	0	0
Tuve un día difícil. Necesito hablar con alguien.	0			0	0	0	0
Boludo, me quedé sin luz. Veni a hacerme compañía	0			0	0	0	0
Hola, soy de ANSES. Necesitamos actualizar tus datos. Hacelo en www.anses-seguridad.com.ar antes del viernes.	1			0	0	0	0
Che, me pasas la tarea? No entendi nada	0			0	0	0	0
Dale, nos vemos en la estacion a las 6	0			0	0	0	0
La receta que pediste está en el cajón de la cocina.	0			0	0	0	0
Hola! Soy del Banco Nacion. Necesitamos actualizar tus datos. Ingresa aca www.bna-seguridad.com y completa la info	1			0	0	0	0
¡Oferta en juguetes para mascotas! Comprá en www.mascotas-juguetes.com.ar y mimá a tu perro o gato.	1			0	0	0	0
Q onda con el auto? Lo pudiste arreglar?	0			0	0	0	0
Estoy en el super, ¿necesitas algo? Leche, huevos, ¿algo mas?	0			0	0	0	0
Che, tu tarjeta de crédito sigue siendo la misma? Necesito comprar algo online y no me anda la mía	1			0	0	0	0
¿Cuál es tu número de pasaporte? Es para la reserva del hotel.	1			0	0	0	0
Che, ¿cuál es tu dirección de email? Quiero enviarte algo importante.	1			0	0	0	0
La transferencia de tus archivos a la nube ha sido completada. Puedes acceder a ellos desde cualquier dispositivo.	0			0	0	0	0
La reserva de tu asiento en el taller de capacitación ha sido confirmada. Te esperamos el próximo sábado.	0			0	0	0	0
Hoy me toca ir al medico, ojala q no me encuentre nada raro	0			0	0	0	0
Necesito comprar un regalo para mi hermana. ¿Algún idea?	0			0	0	0	0
La solicitud de una copia de tus datos personales ha sido procesada. Recibirás un archivo descargable en 72 horas.	0			0	0	0	0
Che, mira esto! Es una oferta increible en www.ofertasHoy.com. No te lo pierdas, solo por hoy!	1			0	0	0	0
¡Advertencia! Tu cuenta será cerrada si no actualizas tus datos ahora. Haz clic aquí.	1			0	0	0	1
Che, mirá esta promo! Entrá a www.promoYa.com.ar y ganate una cena para dos!	1			0	0	0	1
Che, ¿cuál es tu número de tarjeta de crédito? Es para una compra online.	1			0	0	0	0
Hoy fui a una función de teatro. Me encantó la obra	0			0	0	0	0
Tu cuenta de MercadoLibre fue bloqueada. Recuperá tu acceso en www.mercadolibre-recuperacion.com.ar.	1			0	0	0	1
Boludo, me compré una moto. Veni a dar una vuelta	0			0	0	0	0
La sincronización de tu calendario con nuestra aplicación ha sido realizada. Ahora verás tus citas en la aplicación.	0			0	0	0	0
Che, me duele la muela. Sabes un buen dentista?	0			0	0	0	0
¡Oferta en productos de limpieza! Comprá en www.limpieza-descuento.com.ar y dejá tu casa reluciente.	1			0	0	0	0
Completa esta encuesta y gana una tarjeta de regalo de $100. Haz clic aquí.	1			0	0	0	1
Tu cuenta de Netflix necesita verificación. Hacelo en www.netflix-verificacion.com.ar y seguí disfrutando de tus series.	1			0	0	0	1
Has ganado un premio en nuestro sorteo exclusivo. Haz clic aquí para reclamarlo.	1			0	0	0	1
hay una oportunidad de oro para invertir. Ponés $3,000 y te garantizan un retorno de 10 veces en medio año. ¡Vamos a llenarnos de guita, no te lo pierdas!	1			0	0	0	0
La transferencia de tu dominio a nuestro registrador ha sido completada. Bienvenido a nuestro servicio.	0			0	0	0	0
¡Promo en productos de jardinería! Comprá en www.jardin-descuento.com.ar y cuidá de tus plantas.	1			0	0	0	0
Tu cita amorosa te está esperando. Confirma tu asistencia en www.cita-amorosa.com.ar.	1			0	0	0	0
Estoy haciendo ejercicio todos los días. Me siento genial.	0			0	0	0	0
Boludo, me quedé dormido y me perdí el partido. Cómo jugó Messi?	0			0	0	0	0
No puedo creer lo rápido que crecen los niños. ¡Tu hijo ya camina!	0			0	0	0	0
Tu queja sobre el servicio al cliente ha sido registrada. Nos pondremos en contacto contigo pronto.	0			0	0	0	0
La confirmación de tu participación en el evento en línea ha sido recibida. Te enviaremos un recordatorio el día del evento.	0			0	0	0	0
Hoy me hicieron una entrevista en la radio. Fui famoso por un día	0			0	0	0	0
Vamos a la playa el finde, te prendes?	0			0	0	0	0
Che, te enteraste q van a aumentar el gas?	0			0	0	0	0
¡Oferta en artículos de camping! Comprá en www.camping-descuento.com.ar y preparate para la aventura.	1			0	0	0	0
La activación de tu cuenta de desarrollador ha sido completada. Ahora puedes comenzar a publicar en nuestra plataforma.	0			0	0	0	1
Tu crédito ha sido aprobado. Completa el proceso en www.credito-rapido.com.ar y recibe el dinero hoy.	1			0	0	0	0
Vamos a ver el partido en mi casa, venis?	0			0	0	0	0
Che, ¿podés darme tu número de cuenta bancaria? Es para una transferencia.	1			0	0	0	1
Si no me das tu contraseña, voy a tener que cancelar tu cuenta.	1			0	0	0	1
Creo que vi a tu hermano en la tienda. ¿Está en la ciudad?	0			0	0	0	0
El vuelo de mañana ha sido cancelado. Por favor, verifica con la aerolínea.	0			0	0	0	0
Me olvide de comprar el pan, podes pasar por la panaderia?	0			0	0	0	0
Tenes un destornillador? Necesito arreglar algo	0			0	0	0	0
La conferencia de padres y maestros ha sido programada para el viernes. Estoy emocionado de discutir tu progreso.	0			0	0	0	0
La programación de tu mantenimiento regular ha sido establecida para cada primer lunes del mes.	0			0	0	0	0
Che, te enteraste q van a cerrar la fábrica?	0			0	0	0	0
Boludo, se me rompió la lavarropas. Sabes arreglarla?	0			0	0	0	0
La factura de este mes ha sido pagada automáticamente.	0			0	0	0	0
La actualización de tu dirección de correo electrónico ha sido exitosa. Utiliza la nueva dirección para iniciar sesión.	0			0	0	0	0
Estoy en el centro comercial. ¿Necesitas algo?	0			0	0	0	0
Tuve un día largo. Necesito relajarme.	0			0	0	0	0
Tu tarjeta de biblioteca ha sido renovada por otro año.	0			0	0	0	0
La entrega de tu pedido ha sido programada para mañana. Estoy emocionado por ti. ¡Espero que te guste!	0			0	0	0	0
La programación de tu reunión virtual con nuestro equipo de ventas ha sido confirmada. Te enviaremos un recordatorio antes de la reunión.	0			0	0	0	0
Hoy me pongo a estudiar en serio. Basta de joda	0			0	0	0	0
Tu amigo te invitó a jugar online. Unite en www.juego-online.com.ar y divertite con él.	1			0	0	0	0
Tu tarjeta de crédito necesita una actualización. Hacelo en www.tarjeta-actualizacion.com.ar antes de las 18hs.	1			0	0	0	0
Boludo, me quedé sin nafta en la ruta. Veni a buscarme	0			0	0	0	0
Q onda con el trabajo? Como te fue?	0			0	0	0	0
Amigo, ¿viste este video? Me llegó un link y no sé si abrirlo.	1			0	0	0	0
Oye, ¿me mandás una foto de tu licencia de conducir? Es para el seguro del auto.	1			0	0	0	0
Creo que olvidé mi sombrero en tu casa. ¿Lo has visto?	0			0	0	0	0
Te llame mil veces, q hacias?	0			0	0	0	0
Hoy fui a la playa. Me quemé todo, jajaja	0			0	0	0	0
La solicitud de cambio de nombre en tu cuenta ha sido procesada. Utiliza tu nuevo nombre para referirte a tu cuenta.	0			0	0	0	1
Gracias por tu compra. Tu pedido está en camino.	0			0	0	0	0
Tu amigo te envió un regalo. Recibilo en www.regalo-amigo.com.ar y disfrutalo.	1			0	0	0	0
Tu registro para recibir alertas de seguridad ha sido exitoso. Mantente informado de las últimas amenazas.	0			0	0	0	0
Soy del banco, tu cuenta fue hackeada. Cambiá tu contraseña en www.banco-seguro.com.ar ahora.	1			0	0	0	1
La receta que pediste está en el cajón de la cocina. ¡No puedo esperar a probar lo que vas a cocinar!	0			0	0	0	0
Me encontre con tu ex, no sabia q habian cortado	0			0	0	0	0
¡Ganaste un paseo en globo! Reservá tu vuelo en www.globo-vuelo.com.ar y volá alto.	1			0	0	0	0
Vi un coche igual al tuyo. Por un segundo pensé que eras tú.	0			0	0	0	0
Tu cita en el oculista fue confirmada. Revisala en www.oculista-cita.com.ar y cuidá tu vista.	1			0	0	0	0
¡Felicitaciones! Tu foto fue seleccionada en nuestro concurso. Ingresa tus datos en www.foto-premiada.com.ar para reclamar tu premio.	1			0	0	0	0
Me anoté en el gimnasio. A ponerse en forma	0			0	0	0	0
Necesito tu número de CUIL para el contrato. ¿Me lo pasás?	1			0	0	0	0
Soy tu amigo d la secundaria. Necesito q me hagas un favor. Ingresa a www.ayudame-urgente.com y seguime las instrucciones.	1			0	0	0	0
¡Oferta en bicicletas! Comprá en www.bicis-promo.com.ar y pedaleá al aire libre.	1			0	0	0	0
La oferta en nuestra tienda en línea termina a medianoche. Sé que estabas interesado, así que no te lo pierdas.	0			0	0	0	0
Tu cita en la peluquería fue confirmada. Revisala en www.peluqueria-cita.com.ar y renová tu look.	1			0	0	0	0
Q opinas de la nueva ley? Yo no estoy de acuerdo	0			0	0	0	0
Te llegó un paquete. Confirmá tu dirección en URL antes de que lo devuelvan.	1			0	0	0	0
¡Feliz cumple! Espero verte pronto. Te extraño mucho.	0			0	0	0	0
Tu receta médica está lista. Descargala en www.receta-medicina.com.ar y comprá tus medicamentos.	1			0	0	0	0
La integración de tu cuenta con nuestras herramientas de colaboración ha sido completada. Invita a tu equipo para comenzar.	0			0	0	0	1
Tu cuenta ha sido comprometida. Ingresa tus credenciales aquí para verificarla.	1			0	0	0	1
Te aviso q tu factura esta pendiente. Ingresa en este link www.pagaYa.com.ar y salda tu deuda antes d q sea tarde!	1			0	0	0	0
La respuesta a tu pregunta sobre la política de devoluciones ha sido enviada. Tienes 30 días para devolver un producto sin abrir.	0			0	0	0	0
Dale, nos vemos a las 8 en el bar	0			0	0	0	0
Me habló tu ex por Facebook. Q locura, no?	0			0	0	0	0
me das tu dirección completa? Quiero mandarte un regalo.	1			0	0	0	0
La configuración de tu acceso remoto ha sido realizada. Utiliza la autenticación de dos factores para mayor seguridad.	0			0	0	0	0
Hoy fui a una exposición de fotos. Me inspiró mucho	0			0	0	0	0
¡Tu blog ha sido destacado! Mira los comentarios en www.blog-destacado.com.ar.	1			0	0	0	0
La verificación de tu método de pago ha sido exitosa. Ahora puedes realizar compras en nuestra tienda.	0			0	0	0	0
La validación de tu código de descuento ha sido exitosa. Se ha aplicado un 20% de descuento a tu carrito.	0			0	0	0	0
Q haces el domingo? Hay un picado en la cancha	0			0	0	0	0
La eliminación de tu cuenta ha sido programada. Tienes 14 días para cancelar esta acción si cambias de opinión.	0			0	0	0	1
La conexión segura con tu banco ha sido establecida. Puedes comenzar a realizar transacciones en nuestra plataforma.	0			0	0	0	1
Q opinas de los robots? Yo creo q van a dominar el mundo	0			0	0	0	0
Boludo, no te imaginas lo q me pasó ayer. Te cuento despues	0			0	0	0	0
El informe que pediste estará listo mañana. Lo revisé y se ve genial.	0			0	0	0	0
La desactivación de tu cuenta temporal ha sido procesada. Puedes reactivarla en cualquier momento dentro de los próximos 60 días.	0			0	0	0	1
Dale, nos vemos en el cine a las 8	0			0	0	0	0
La fecha límite para el proyecto ha sido cambiada a la próxima semana.	0			0	0	0	0
La cancelación de tu alerta de empleo ha sido procesada. Puedes crear nuevas alertas en cualquier momento.	0			0	0	0	0
La reparación de tu dispositivo está en progreso. Te notificaremos cuando esté lista para ser recogida.	0			0	0	0	0
La receta que me pediste está en el libro en la estantería.	0			0	0	0	0
Che, te enteraste lo q pasó en el barrio? Unos chorros robaron en la esquina	0			0	0	0	0
Tu reserva en el restaurante ha sido confirmada. Nos vemos a las 7.	0			0	0	0	0
La reunión con el equipo ha sido programada para las 2 p. m. Prepárate para discutir nuestros próximos pasos.	0			0	0	0	0
Che, te enteraste de la fiesta sorpresa para Fede?	0			0	0	0	0
La entrega de tu pedido se ha retrasado. Lamentamos el inconveniente.	0			0	0	0	0
¡Advertencia! Tu cuenta será cerrada si no actualizas tus datos ahora. Haz clic aquí.	1			0	0	0	1
Dale, nos vemos en la esquina a las 7	0			0	0	0	0
La actualización de tu software ha sido completada. Si experimentas problemas, no dudes en contactarnos.	0			0	0	0	0
Tu solicitud de préstamo ha sido aprobada. Si tienes alguna pregunta sobre los detalles, estoy aquí para ayudarte.	0			0	0	0	0
Necesito ayuda con mi tarea. ¿Tienes tiempo mañana?	0			0	0	0	0
Mi coche no arranca. ¿Puedes venir a ayudarme?	0			0	0	0	0
Che, me olvide las llaves, me abris?	0			0	0	0	0
¡Ganaste un día de pesca! Reservá tu lugar en www.pesca-gratis.com.ar y pescá tu cena.	1			0	0	0	1
¡Ofertón en juegos de PlayStation! Solo por hoy en URL. ¡Aprovechá!	1			0	0	0	0
Tu solicitud de cambio de dirección ha sido procesada. Todo está actualizado ahora.	0			0	0	0	0
¡Tu equipo ganó! ¿Viste el juego?	0			0	0	0	0
Necesito tu número de pasaporte para reservar el vuelo. ¿Me lo das?	1			0	0	0	0
Tu vuelo ha sido confirmado. Aquí tienes tu boleto. ¡Estoy emocionado por tu aventura!	0			0	0	0	0
Te vi en el colectivo pero no te saludé porque estabas dormido	0			0	0	0	0
Che, me olvide la billetera, me prestas plata?	0			0	0	0	0
La solicitud de reembolso para tu compra ha sido aprobada. El dinero será devuelto a tu cuenta original.	0			0	0	0	1
La reserva de tu tutorial en línea con nuestro experto ha sido confirmada. Asegúrate de tener una cámara y micrófono funcionales.	0			0	0	0	0
Viste el golazo q metio Messi? Increible	0			0	0	0	0
El libro que pediste ya está en la biblioteca. Puedes pasar a recogerlo cuando quieras.	0			0	0	0	0
La eliminación de tu información de pago ha sido realizada. Si deseas realizar una compra, deberás ingresar la información nuevamente.	0			0	0	0	0
Gana dinero fácilmente participando en nuestra encuesta exclusiva. Haz clic aquí.	1			0	0	0	0
La reunión con el equipo ha sido programada para las 2 p. m. Te veré allí.	0			0	0	0	0
¿Podés enviarme una foto de tu pasaporte? Es para una reserva de hotel.	1			0	0	0	0
Tu pedido ha sido enviado. Aquí tienes el número de seguimiento.	0			0	0	0	0
Q grande Lauti, se recibió y consiguió laburo enseguida	0			0	0	0	0
Q haces el finde? Hay un asado en lo de Juan	0			0	0	0	0
Voy a la playa este fin de semana. ¿Te gustaría unirte?	0			0	0	0	0
La reparación de tu coche costará $500. ¿Estás de acuerdo con eso? Avísame lo que piensas.	0			0	0	0	0
¡Ganaste un fin de semana en un hotel 5 estrellas! Reservá en www.hotel-lujo.com.ar y disfrutá.	1			0	0	0	0
Soy tu vecino del 3°B. Mirá estas fotos en www.tusfotos-online.com, ¿no es tu auto?	1			0	0	0	0
No puedo creer lo caro q está todo. Me arruiné haciendo las compras	0			0	0	0	0
